{"address_policy_digest":"1ea86053014b8f14af3ce05ee44949eb602c5af02fd190bbde777d2cc4d6a535","allowed_browse_domain":"example.test","allowed_target_ports":[80,443],"allowed_target_schemes":["http","https"],"carrier_path":"/_zp/carrier","deployment_id":"KRib0e8IYdaIz9DVM7HKVnarA5XwmdzeeBB8FJyYDTA","display_name":"ZeroProxy development relay","expires_at":"2027-01-01T00:00:00Z","issued_at":"2026-07-01T00:00:00Z","key_epoch":1,"limits":{"download_byte_budget":1073741824,"handshake_timeout_ms":10000,"idle_timeout_ms":60000,"max_frame_bytes":65536,"max_frames_per_second":1000,"max_message_bytes":1048576,"max_sessions":64,"max_streams":64,"session_deadline_ms":900000,"upload_byte_budget":1073741824},"privacy_disclosure":"The relay sees the client IP, target hostname and port, timing and volume, and plaintext HTTP, but not verified HTTPS plaintext.","profile_id":"zeroproxy-development-relay","relay_wss_origin":"wss://relay.example.test","schema_version":1,"tor_mode":"SOCKS5_DOMAIN_RFC1929"}